regression,r2,const_coef,const_tstat,value_spread_coef,value_spread_tstat,x_minus_xbar_coef,x_minus_xbar_tstat,log_industry_btm_coef,log_industry_btm_tstat
HML on value spread,0.03414575485889637,-0.048537045100195124,-3.381828362233836,0.06035134531005788,3.8441533441522435,,,,
HML on aggregate productivity,0.030431318061896473,0.003126818052829771,1.2774933175029815,,,-1.439200666312861,-3.622089964924962,,
HML on value spread and aggregate productivity,0.03451700607919206,-0.06976599110645391,-1.2701545417958824,0.08527424851375773,1.3283983077622703,0.6493242441228648,0.4004328131322868,,
Market return on industry B/M,0.03720125002136365,1.0736051943804334,64.3563992824504,,,,,0.08076517269014485,4.018825493666463
Market return on value spread,0.04774348469841294,0.9018143994591824,38.24043100372181,0.1180937978133442,4.577920237356649,,,,
